"Development of a Mobile Robot: Robotic Guide Dog for Aid of Visual Disabilities in Urban Environments","D. R. Bruno; M. H. de Assis; F. S. Osório","Institute of Mathematics and Computer Science, University of São Paulo; São Paulo State Technological College, Sao Paulo, Brazil; Institute of Mathematics and Computer Science, University of São Paulo, Sao Paulo, Brazil","2019 Latin American Robotics Symposium (LARS), 2019 Brazilian Symposium on Robotics (SBR) and 2019 Workshop on Robotics in Education (WRE)","2 Mar 2020","2019","","","104","108","The general objective of this work is to develop a mobile robotic platform that is able to avoid obstacles for the benefit of visually impaired people. The idea is that this platform is a robot ""guide dog"" ~for visually impaired persons, and animal guide dogs like these have very high costs (on average 40 thousand dollars - Our current robotic prototype has a cost of 400 dollars), also need a long time for training (more than 1 year), being therefore inaccessible to many visually impaired persons. Our work then turns to social robotics, where we have a big problem with disabled people and who do not get freedom to move around in urban spaces without the help of a caregiver. By collecting data from ultrasound sensors, managing a possible path to the target point in an autonomous manner, using a computer vision system to recognize and treat the obstacles encountered, representing these in the form of audio to the user. The prototype was developed to serve as a platform for research in the development of navigational algorithms and computer vision systems of the automation laboratory of the (omitted for blind review). The robot presented good results in tests with navigation algorithms and computer vision that were applied to validate this platform in tests with visually impaired people in IDVC - (Catanduva Institute for the Visually Impaired).","2643-685X","978-1-7281-4268-5","10.1109/LARS-SBR-WRE48964.2019.00026","","https://ieeexplore.ieee.org/stamp/stamp.jsp?arnumber=9018597","Deep Learning;Mobile Robotics;Vision in robotics and automation","Robot sensing systems;Mobile robots;Computer vision;Genetic algorithms;Dogs","collision avoidance;computer vision;handicapped aids;mobile robots","disabled people;computer vision;visually impaired people;robotic guide dog;visual disabilities;urban environments;mobile robotic platform;robot guide dog;visually impaired persons;robotic prototype;social robotics;animal guide dogs;ultrasound sensors;navigational algorithms;obstacle avoidance","","8","","8","IEEE","2 Mar 2020","","","IEEE","IEEE Conferences"
"Human or Robot University Tutor? Future Teachers’ Attitudes and Learning Outcomes","A. -M. Velentza; N. Fachantidis; I. Lefkos","School of Educational & Social Policies, University of Macedonia, GR; School of Educational & Social Policies, University of Macedonia, GR; School of Educational & Social Policies, University of Macedonia, GR","2021 30th IEEE International Conference on Robot & Human Interactive Communication (RO-MAN)","23 Aug 2021","2021","","","236","242","In the coming years, social robots will be widely used in the educational field. Therefore, it is important to identify the future educators’ attitudes towards the use of robots and technological tools. In this paper, we investigate how the exposure of students/pre-service teachers in a robot-tutor can affect their attitudes towards the use of robots in education. We compare a university professor with a robot-tutor in a university class and we demonstrate how each one changes the students’ attitudes towards the use of robots and technology in education as well as the students learning outcome from the course. Furthermore, based on the results of the four experiments we conducted, we also demonstrate the changes in students’ attitudes when they have just a single lesson with a robot-tutor and when they have two courses. Our results demonstrate all students were more positive about the use of robots (and technology) in education after having a course with the robot-tutor than when they had a lecture with a human. Moreover, they had a similar knowledge acquisition level, as indicated by the given knowledge test in both human and robot-tutor conditions. Especially in the case that they had a second lecture with the robot-tutor, they got statistically significantly higher scores in the test in comparison with those who had only one lecture. Our results suggest that a robot-tutor can be an effective tutor, capable of changing students’ attitudes and improving knowledge. Moreover, since the university students in our experiments were pre-service teachers, our paper can act as a reference for teaching, the next generation of teachers, that a robot-tutor can be a useful colleague.","1944-9437","978-1-6654-0492-1","10.1109/RO-MAN50785.2021.9515521","","https://ieeexplore.ieee.org/stamp/stamp.jsp?arnumber=9515521","human robot interaction;robot tutor;attitudes towards robots;learning outcome;pre-service teachers","Knowledge acquisition;Education;Tools;Robots;Next generation networking","educational courses;educational institutions;educational robots;human factors;intelligent tutoring systems;teaching","educators attitudes;robot-tutor conditions;robot university tutor;social robots;learning outcomes;teacher attitudes;educational field;technological tools;pre-service teachers;university professor;university class;students attitudes;knowledge acquisition level;knowledge test;university students;teaching","","2","","29","IEEE","23 Aug 2021","","","IEEE","IEEE Conferences"
"Design and Experiment of Multi-Modal Intelligent Elderly Assisted Wheelchair Robot","Y. Zhang; H. Mao; S. Yu; A. Zhu; X. Wang; N. Wang; Z. Zhang; H. Xu","Shaanxi Key Laboratory of Intelligent Robots, Institute of Robotics & Intelligent Systems, Xi'an Jiaotong University, Xi'an, China; Shaanxi Key Laboratory of Intelligent Robots, Institute of Robotics & Intelligent Systems, Xi'an Jiaotong University, Xi'an, China; Key Laboratory of Education Ministry for Modern Design and Rotor-Bearing System, Xi'an, China; Shaanxi Key Laboratory of Intelligent Robots, Institute of Robotics & Intelligent Systems, Xi'an Jiaotong University, Xi'an, China; School of Construction Machinery, Chang'an University, Xi'an, China; Key Laboratory of Education Ministry for Modern Design and Rotor-Bearing System, Xi'an, China; Shaanxi Key Laboratory of Intelligent Robots, Institute of Robotics & Intelligent Systems, Xi'an Jiaotong University, Xi'an, China; Shaanxi Key Laboratory of Intelligent Robots, Institute of Robotics & Intelligent Systems, Xi'an Jiaotong University, Xi'an, China","2023 International Conference on Advanced Robotics and Mechatronics (ICARM)","25 Aug 2023","2023","","","1023","1028","In response to the prevalent social issue of elderly individuals living alone who lack independent mobility and face difficulties in standing up and getting up, a multi-modal intelligent elderly assistance wheelchair robot has been developed to provide assistance in such scenarios. This paper presents the analysis of the assistance needs of the elderly, along with the proposed main functions of the robot. The mechanical structure of the robot was designed and verified through finite element analysis, followed by experimental verification of assisted standing, transformation of bed and chair form, assisted getting up, and knee-free bending assisted getting up functions. The results of the experiments demonstrate that the multi-modal intelligent wheelchair robot developed in this study can effectively assist the elderly living alone in completing the actions of getting up and standing, thereby reducing their physical burden in home activities and improving their quality of life. This development has potential for broader applicability in the field of elderly care.","","979-8-3503-0017-8","10.1109/ICARM58088.2023.10218813","Fundamental Research Funds for the Central Universities(grant numbers:xzd012022019); ","https://ieeexplore.ieee.org/stamp/stamp.jsp?arnumber=10218813","","Mechatronics;Wheelchairs;Bending;Finite element analysis;Mobile robots;Older adults;Faces","bending;finite element analysis;geriatrics;handicapped aids;mobile robots;wheelchairs","assistance needs;assisted standing;elderly individuals;elderly living;multimodal intelligent elderly assistance wheelchair robot;multimodal intelligent elderly assisted wheelchair robot;multimodal intelligent wheelchair robot","","","","14","IEEE","25 Aug 2023","","","IEEE","IEEE Conferences"
"Scientific mapping of 35 years of human factors research in occupational human-robot-interaction","P. H. Rosen; S. Wischniewski","Federal Institute of Occupational Safety and Health (BAuA), Unit “Human Factors, Ergonomics”, Friedrich-Henkel-Weg 1-25, Dortmund, Germany; Federal Institute of Occupational Safety and Health (BAuA), Unit “Human Factors, Ergonomics”, Friedrich-Henkel-Weg 1-25, Dortmund, Germany","2019 IEEE International Conference on Advanced Robotics and its Social Impacts (ARSO)","6 Jan 2020","2019","","","235","239","The field of human-robot-interaction is undergoing a constant change due to ongoing technological innovations. This paper addresses the research question, whether human factors concepts related to occupational human-robot-interaction show a similar development. First a search algorithm based literature search was done in different databases. We then used a combined approach of text mining technique as well as a rater based judgment in order to map the identified literature according to human factors concepts.","2162-7576","978-1-7281-3176-4","10.1109/ARSO46408.2019.8948725","","https://ieeexplore.ieee.org/stamp/stamp.jsp?arnumber=8948725","","Text mining;Economics;Technological innovation;Employment;Human factors;Task analysis;Robots","data mining;human factors;human-robot interaction","search algorithm based literature search;human factors research;occupational human-robot-interaction;technological innovations;text mining technique;rater based judgment","","1","","12","IEEE","6 Jan 2020","","","IEEE","IEEE Conferences"
"Mechatronic Systems Design of ROHNI-1: Hybrid Cyber-Human Medical Robot for COVID-19 Health Surveillance at Wholesale-Supermarket Entrances","R. M. Ñope-Giraldo; L. A. Illapuma-Ccallo; J. Cornejo; P. Palacios; J. L. Napán; F. Cruz; R. Palomares; J. A. Cornejo-Aguilar; M. Vargas","Professional School of Mechatronics Engineering, Universidad Ricardo Palma, Lima, Peru; Professional School of Mechatronics Engineering, Universidad Ricardo Palma, Lima, Peru; Professional School of Mechatronics Engineering, Universidad Ricardo Palma, Lima, Peru; Bioastronautics & Space Mechatronics Research Group, Lima, Peru; Bioastronautics & Space Mechatronics Research Group, Lima, Peru; Professional School of Mechatronics Engineering, Universidad Ricardo Palma, Lima, Peru; Professional School of Mechatronics Engineering, Universidad Ricardo Palma, Lima, Peru; Faculty of Human Medicine, Universidad Ricardo Palma, Lima, Peru; Faculty of Health Sciences, Universidad de León, León, Spain","2021 Global Medical Engineering Physics Exchanges/Pan American Health Care Exchanges (GMEPE/PAHCE)","24 May 2021","2021","","","1","7","The critical situation of COVID-19 widespread in Perú from the beginning of year 2020, has been maximized by the avoidance of social distancing reflected in crowded public places where most people go without any personal protective equipment (PPEs) leading to higher risk of virus transmission. Therefore, an innovative research has been conducted in 2020 under the supervision of the Mechatronic Engineering Laboratory at Ricardo Palma University and Bioastronautics & Space Mechatronics Research Group, resulting in the proposed project named “ROHNI-1” medical robot, as Social Humanoid Machine, that is going to be located at the entrance of a wholesale-supermarket. It is composed by 3 wheels in the chassis-base and 2 anthropomorphic arms of 4 DOF each. In order to perform an efficient human-machine interaction, it can develop 3 functions such as Detection of mask, Disinfection of hands and Monitoring of vital signs. This study presents a mechatronics conceptual design using the software SolidWorks 2020 for 3D mechanical systems development, Proteus 8 for electrical and electronics circuit technical schematics, and also, Matlab 2020a for kinematic motion testing of the robotic arms. In conclusion, favourable simulation results were achieved; the robot manufacturing is expected to be ready by 2021, and due to frugal-innovation engineering analysis, it is planned to be donated to Latin American countries working with supermarket-chains.","2327-817X","978-1-7281-7054-1","10.1109/GMEPE/PAHCE50215.2021.9434874","","https://ieeexplore.ieee.org/stamp/stamp.jsp?arnumber=9434874","COVID-19;ROHNI-1;Medical Robot;Social Humanoid Machine;Detection;Disinfection;Monitoring;Wholesale-Supermarket","COVID-19;Mechatronics;Medical robotics;Three-dimensional displays;Surveillance;Humanoid robots;Wheels","CAD;control engineering computing;design engineering;humanoid robots;mechanical engineering computing;mechatronics;medical robotics;product design;robot kinematics;robot vision","ROHNI-1;hybrid cyber-human medical robot;COVID-19 health surveillance;wholesale-supermarket entrances;Perú;social distancing;crowded public places;personal protective equipment;PPEs;Mechatronic Engineering Laboratory;Ricardo Palma University;anthropomorphic arms;human-machine interaction;mechatronics conceptual design;3D mechanical systems development;electrical electronics circuit technical schematics;robotic arms;robot manufacturing;supermarket-chains;innovation engineering analysis;SolidWorks 2020 software;social humanoid machine;Bioastronautics and Space Mechatronics Research Group","","22","","76","IEEE","24 May 2021","","","IEEE","IEEE Conferences"
"Cognitive Exercise for Persons With Alzheimer's Disease and Related Dementia Using a Social Robot","F. Yuan; M. Boltz; D. Bilal; Y. -L. Jao; M. Crane; J. Duzan; A. Bahour; X. Zhao","Department of Mechanical, Aerospace, and Biomedical Engineering, University of Tennessee, Knoxville, TN, USA; College of Nursing, Pennsylvania State University, University Park, PA, USA; School of Information Sciences, University of Tennessee, Knoxville, TN, USA; College of Nursing, Pennsylvania State University, University Park, PA, USA; Genesis Neuroscience Clinic, Knoxville, TN, USA; Genesis Neuroscience Clinic, Knoxville, TN, USA; Department of Electrical Engineering and Computer Science, University of Tennessee, Knoxville, TN, USA; Department of Mechanical, Aerospace, and Biomedical Engineering, University of Tennessee, Knoxville, TN, USA","IEEE Transactions on Robotics","9 Aug 2023","2023","39","4","3332","3346","Reminiscence therapy (RT) can improve the mood and communication of persons living with Alzheimer's disease and Alzheimer's-disease-related dementias (PLWD). Traditional RT requires professionals' facilitation, limiting its accessibility to PLWD. Social robotics has the potential to facilitate RT, enabling accessible home-based RT. However, studies are needed to investigate how PLWD would perceive a robot-mediated reminiscence therapy (RMRT) and how to develop RMRT for positive user experience and successful adoption. In this article, we develop a prototype of RMRT using a humanoid social robot and test it with 12 participants (seven PLWD, two with mild cognitive impairment, and three informal caregivers). The robot automatically displays a memory trigger on its tablet and engages participants in a relatable conversation during RMRT. A mixed-method approach is employed to assess its acceptability and usability. Our results show that PLWD have an overall positive user experience with the RMRT. Participants laugh and sing along with the robot during RMRT and demonstrate intention to use it. In addition, we discuss a robot control method and several critical problems for RMRT. The RMRT can facilitate both verbal and nonverbal social interaction for PLWD and holds promise for engaging, personalized, and efficient home-based cognitive exercises for PLWD.","1941-0468","","10.1109/TRO.2023.3272846","National Institutes of Health(grant numbers:R01AG077003); ","https://ieeexplore.ieee.org/stamp/stamp.jsp?arnumber=10136814","Alzheimer's disease;cognitive exercise;dementia care;reminiscence therapy (RT);social robots","Robots;Videos;Usability;Oral communication;Social robots;Chatbots;Graphical user interfaces","cognition;diseases;geriatrics;human computer interaction;human-robot interaction;humanoid robots;medical computing;neurophysiology","accessible home-based RT;Alzheimer's disease;Alzheimer's-disease;cognitive exercise;efficient home-based cognitive exercises;engaging home-based cognitive exercises;humanoid social robot;mild cognitive impairment;nonverbal social interaction;personalized, home-based cognitive exercises;positive user experience;professionals;relatable conversation;related dementia;RMRT;robot control method;robot-mediated reminiscence therapy;seven PLWD;social robotics;verbal interaction","","","","56","IEEE","26 May 2023","","","IEEE","IEEE Journals"
"Therapists' Opinions on Telehealth, Robotics, and Socially Assistive Robot-Augmented Telepresence Systems for Rehabilitation","M. J. Sobrepera; V. G. Lee; M. J. Johnson","School of Engineering and Applied Sciences, Department of Mechanical Engineering and Applied Mechanics, University of Pennsylvania, Philadelphia, PA, USA; School of Engineering and Applied Sciences' Department of General Robotics, Automation, Sensing, & Perception (GRASP), University of Pennsylvania, Philadelphia, PA, USA; Department of Physical Medicine and Rehabilitation and BioEngineering. She directs the Rehab Robotics Lab (A GRASP Lab), University of Pennsylvania, Philadelphia, PA, USA","2022 9th IEEE RAS/EMBS International Conference for Biomedical Robotics and Biomechatronics (BioRob)","3 Nov 2022","2022","","","1","8","Shortages in therapists, along with the COVID-19 pandemic, have created a gap in care for people with cerebral palsy, stroke, and many other conditions requiring rehabilitation. Socially assistive robots and telehealth are two tools which could help fill this gap and may be able to work together, in socially assistive robot-augmented telerehabilitation, to create meaningful telerehab encounters. We present results from a survey completed between Jun 31, 2020, and Dec 31, 2020, asking 379 therapists in the United States for their opinions on features which may be useful for a telerehabilitation platform and for their general feelings towards robots. We explore their answers and reduce the response space by identifying six factors underlying the answers. We show that therapists want high quality video, control over robots, and more regulations. We also find that they are positive about the features which could be used in socially assistive robot-augmented telerehabilitation.","2155-1782","978-1-6654-5849-8","10.1109/BioRob52689.2022.9925557","National Institutes of Health(grant numbers:F31HD102165); ","https://ieeexplore.ieee.org/stamp/stamp.jsp?arnumber=9925557","","COVID-19;Telepresence;Pandemics;Telemedicine;Social robots;Biomechatronics;Stroke (medical condition)","assistive robots;handicapped aids;medical computing;medical robotics;patient rehabilitation;telemedicine","therapists;telehealth;socially assistive robot-augmented telerehabilitation;socially assistive robots;conditions requiring rehabilitation;COVID-19 pandemic;socially assistive robot-augmented telepresence systems;robotics","","","","28","IEEE","3 Nov 2022","","","IEEE","IEEE Conferences"
"A Metaethical Reflection: The Ethics of Embedding Ethics into Robots","J. Borenstein; R. C. Arkin; A. R. Wagner","School of Public Policy and Office of Graduate Education, Georgia Institute of Technology; School of Interactive Computing, Georgia Institute of Technology; Rock Ethics Institute, Pennsylvania State University","2022 IEEE International Conference on Advanced Robotics and Its Social Impacts (ARSO)","27 Jun 2022","2022","","","1","3","This paper examines the metaethical dimensions of the computing community’s efforts to program ethical decision-making abilities into robots. Arguments for and against that endeavor are outlined along with brief recommendations for the human-robot interaction realm.","2162-7576","978-1-6654-7966-0","10.1109/ARSO54254.2022.9802973","National Science Foundation; ","https://ieeexplore.ieee.org/stamp/stamp.jsp?arnumber=9802973","","Ethics;Conferences;Decision making;Human-robot interaction;Reflection;Robots","decision making;ethical aspects;human-robot interaction","computing community;embedding ethics;ethical decision-making abilities;human-robot interaction realm;metaethical dimensions;metaethical reflection","","","","12","IEEE","27 Jun 2022","","","IEEE","IEEE Conferences"
"Can Non-Humanoid Social Robots Reduce Workload of Special Educators : An Online and In-Premises Field Study","N. Paul; S. Ramesh; C. Bhattacharya; J. Ramesh; P. Vijayan","Department of Computer Science and Automation, Indian Institute Of Science, Bengaluru, India; Department of Computer Science and Automation, Indian Institute Of Science, Bengaluru, India; Department of Computer Science and Automation, Indian Institute Of Science, Bengaluru, India; Academy for Severe Handicaps and Autism(ASHA); Academy for Severe Handicaps and Autism(ASHA)","2021 IEEE International Conference on Robotics and Automation (ICRA)","18 Oct 2021","2021","","","11386","11392","Although Socially Assistive Robotics have been used in Autism Spectrum Disorder (ASD) interventions, such studies often exclude Special Educators (SEs) and often use expensive humanoid robots. In this paper, we investigate whether non-humanoid toy robots can act as teaching aids in ASD Education, in particular, can they reduce the workload of SEs. We target two most common yet divergent problems from Individualized Education Plans (IEPs) of ASD children - communication and gross motor skills. We present results from three studies a) toy robot Cozmo assists SEs in verbal lessons in school premises, b) mini drone Tello helps SEs in exercise lessons in school premises, and c) Cozmo, SEs, and ASD children connect remotely, as mandated due to the Covid-19 pandemic, for verbal lessons. All three studies showed improvement in learning outcomes and reduction in prompts from the SEs, denoting reduced workload. The effect of a robot's virtual presence in online ASD interventions has not been studied before. However, our results show that children spent more time on lessons in online intervention with Cozmo, suggesting that using robots should also be considered when designing online interventions. Furthermore, the roles of Cozmo were analyzed, and we found children showed increased spontaneous interaction when Cozmo acts as a Co-Instructor. Thus, preliminary results indicate toy robots, as opposed to expensive humanoids, may have significant potential in aiding SEs in Autism education.","2577-087X","978-1-7281-9077-8","10.1109/ICRA48506.2021.9561633","","https://ieeexplore.ieee.org/stamp/stamp.jsp?arnumber=9561633","","Autism;Pandemics;Robot kinematics;Toy manufacturing industry;Education;Humanoid robots;Variable speed drives","computer aided instruction;handicapped aids;humanoid robots;human-robot interaction;medical disorders;robot vision;teaching","nonhumanoid social robots reduce workload;Special Educators;In-Premises Field Study;Socially Assistive Robotics;Autism Spectrum Disorder interventions;SEs;expensive humanoid robots;nonhumanoid toy robots;ASD Education;Individualized Education Plans;ASD children - communication;toy robot Cozmo;verbal lessons;school premises;reduced workload;online ASD interventions;online intervention;designing online interventions;expensive humanoids;Autism education","","","","36","IEEE","18 Oct 2021","","","IEEE","IEEE Conferences"
