"Automated Care in New Zealand","M. O. Ulset; E. Broadbent; T. H. Eriksen","Department of Social Anthropology, University of Oslo, Oslo, Norway; Department of Psychological Medicine, The University of Auckland, Auckland, New Zealand; Department of Social Anthropology, University of Oslo, Oslo, Norway","2022 17th ACM/IEEE International Conference on Human-Robot Interaction (HRI)","29 Sep 2022","2022","","","959","962","With the growing speed of automation, robots are taking on social care roles. In retirement villages and activity centers for older adults in New Zealand, the robotic seal Paro has become a valuable unpaid staff member contributing to the social life of people who struggle with the effects of dementia. This study aimed to investigate the role of Paro as an agent of care during a time with a steady push towards automation and digitalization of welfare services in New Zealand. As a part of the study four care workers, a family member of a former resident, and three researchers from aNew Zealand based robotics research group participated in in-depth interviews pertaining to the participant's own experiences, opinions, and motivations for using or working with social robots. Results found that Paro was used to increase residents' quality of life rather than reasons of automation for profit.","","978-1-6654-0731-1","10.1109/HRI53351.2022.9889448","","https://ieeexplore.ieee.org/stamp/stamp.jsp?arnumber=9889448","Care robot;Automation;New Public Management","Automation;Social robots;Seals;Older adults;Interviews;Retirement;Dementia","assistive robots;geriatrics;health care;mobile robots;social robots","automated care;social care roles;retirement villages;activity centers;older adults;robotic seal Paro;care workers;social robots;New Zealand based robotics research group;unpaid staff member;dementia effect","","","","13","IEEE","29 Sep 2022","","","IEEE","IEEE Conferences"
"Walking Control of Biped Robots on Uneven Terrains Based on SLIP Model","X. Meng; Z. Yu; G. Huang; X. Chen; W. Qi; Q. Huang; B. Su","School of Mechatronical Engineering, Beijing Institute of Technology, Beijing, China; Beijing Advanced Innovation Center for Intelligent Robotics and Systems, Beijing Institute of Technology, Key Laboratory of Biomimetic Robots and Systems, Ministry of Education, Beijing, China; Beijing Advanced Innovation Center for Intelligent Robotics and Systems, Beijing Institute of Technology, Key Laboratory of Biomimetic Robots and Systems, Ministry of Education, Beijing, China; International Joint Research Laboratory of Biomimetic Robots and Systems, Ministry of Education, Beijing Advanced Innovation Center for Intelligent Robotics and Systems, Beijing Institute of Technology, Beijing, China; School of Mechatronical Engineering, Beijing Institute of Technology, Beijing, China; International Joint Research Laboratory of Biomimetic Robots and Systems, Ministry of Education, Beijing Advanced Innovation Center for Intelligent Robotics and Systems, Beijing Institute of Technology, Beijing, China; China North Vehicle Research Institute, Beijing, China","2019 IEEE International Conference on Advanced Robotics and its Social Impacts (ARSO)","6 Jan 2020","2019","","","174","179","Having human-like legged structure, biped robots are regarded as the most promising robots that can take the place of human to work in the environments designed for human beings. To this end, it is the premise for biped robots to achieve stable walking on uneven ground. This paper presents a control strategy for a biped robot based on spring-loaded inverted pendulum (SLIP) model, which controls the joint torque of the robot by obtaining the errors of length and angular position of virtual spring legs. Additionally, this paper proposes a new control method of adjusting the length of legs to enable the robot to achieve stable walking on unstructured terrains, such as staircases. In the end, the simulation results corroborate the effectiveness of the proposed approaches.","2162-7576","978-1-7281-3176-4","10.1109/ARSO46408.2019.8948795","","https://ieeexplore.ieee.org/stamp/stamp.jsp?arnumber=8948795","","","legged locomotion;pendulums;robot dynamics;springs (mechanical)","biped robot;SLIP model;stable walking;spring-loaded inverted pendulum model;human-like legged structure","","3","","15","IEEE","6 Jan 2020","","","IEEE","IEEE Conferences"
"Analyzing the Impact of New Instruction Method Using Hardware Control Such As Robotics in Learning Programming","B. Koyuncu; M. Fetaji; B. Fetaji; A. Sefidanovski","Computer Science Ilindenska bb, South East European University, Tetovo, Republic of Macedonia; Computer Science Ilindenska bb, South East European University, Tetovo, Republic of Macedonia; Computer Science, Mother Teresa University, Skopje, Macedonia; Computer Science Ilindenska bb, South East European University, Tetovo, Republic of Macedonia","2019 8th Mediterranean Conference on Embedded Computing (MECO)","15 Jul 2019","2019","","","1","4","This research work aims to find out how students gain knowledge involving in robotics instruction method and learning programing languages with robotics tools. Teaching programming language via hardware control such as robotics is very popular in this time and in the future. We expect this will make students learn programming language with great eagerness within very popular technology `robotics. The second aim of this study is to inform computer science teachers about how much their instruction methods based on robotics affects the outcome of their class. We expect this study will have positive effects to the field of computer science education. The computer science class is different from other classes. Computer science teachers have to use new educational methods because of continuously improving technology. The entire world are getting instant information what is new in technology via social medias. Computer science teachers should take the first step to introduce the news to their students in a practical way. It is the way to make students to see the changes on technology in the class.","2637-9511","978-1-7281-1740-9","10.1109/MECO.2019.8760058","","https://ieeexplore.ieee.org/stamp/stamp.jsp?arnumber=8760058","Instructional methodology;programming robots;educational methodology;Computer-assisted instruction","Robots;Education;Programming profession;Computer languages;Tools","computer aided instruction;computer science education;educational courses;educational robots;programming languages;social networking (online);teaching","social media;teaching programming language;robotics tools;learning programing languages;robotics instruction method;hardware control;new instruction method;computer science education;computer science teachers","","2","","9","IEEE","15 Jul 2019","","","IEEE","IEEE Conferences"
"Localization of Older People in an Indoor Scenario: A Measurement System Based on PIR Sensors Installed in a Social Robot","I. Ciuffreda; S. Casaccia; G. M. Revel","Dip. di ingegneria Industriale e scienze matematiche, Università Politecnica delle Marche, Ancona, Italy; Dip. di ingegneria Industriale e scienze matematiche, Università Politecnica delle Marche, Ancona, Italy; Dip. di ingegneria Industriale e scienze matematiche, Università Politecnica delle Marche, Ancona, Italy","2023 IEEE International Workshop on Metrology for Living Environment (MetroLivEnv)","4 Jul 2023","2023","","","208","212","People detection is widely used in remote health monitoring and smart homes. Passive infrared (PIR) sensors are the most used devices-free detection system for their affordability, non-invasiveness, low power consumption and high accuracy. However, there are still many challenges related to analyzing digital output data to extract useful information with multi-PIR systems. Thus, in this paper we propose a measurement system composed of multi-PIR sensors mounted on the head of a mobile social robot in which the granularity of the overlapped field of view (FoV) of sensors are considered to increase the localization accuracy. In addition, a Decision Tree (DT) classifier algorithm is trained on the system data to improve the localization accuracy. The results show that the accuracy of the system is 96% for tests performed in controlled environments when subjects have gait movement constraints. The accuracy of the system decreases (83.3%) when no constraints are applied.","","978-1-6654-5693-7","10.1109/MetroLivEnv56897.2023.10164045","European Commission; ","https://ieeexplore.ieee.org/stamp/stamp.jsp?arnumber=10164045","PIR sensors;localization;social robot;machine learning","Location awareness;Power demand;Social robots;Smart homes;Machine learning;Metrology;Sensor systems","assisted living;decision trees;mobile robots;patient monitoring;social robots","decision tree classifier algorithm;device-free detection system;digital output data;indoor scenario;localization accuracy;measurement system;mobile social robot;multiPIR sensors;multiPIR systems;noninvasiveness;older people;people detection;PIR sensors;remote health monitoring;smart homes;system data","","","","21","IEEE","4 Jul 2023","","","IEEE","IEEE Conferences"
"Tiredness Detection for a Robotic Mobility Aid","C. Dong; J. Kennedy; M. K. X. J. Pan; Z. Xiu; C. Zhang; H. Tan","UBTECH NA RESEARCH & DEV CTR CORP, Pasadena, USA; Futronics NA Corporation, Pasadena, USA; Electrical and Computer Engineering Department, Queen’s University, Kingston, Canada; Futronics NA Corporation, Pasadena, USA; Futronics NA Corporation, Pasadena, USA; Futronics NA Corporation, Pasadena, USA","2022 IEEE International Conference on Advanced Robotics and Its Social Impacts (ARSO)","27 Jun 2022","2022","","","1","4","The proportion of elderly people in society is predicted to continue to rise in the coming decades. Mobility is a key aspect of many daily activities, but falls become an increasingly significant health risk with age. With the COVID-19 pandemic, many elderly users prefer or require assistive devices, rather than human support, in walking and carrying out daily tasks. However, prior work has shown that when using passive assistive mobility devices, fall risks can actually increase. This presents an opportunity for assistive robots to help maintain and improve the mobility of elderly users, with an additional emphasis on safety, made possible through sensing capabilities. In this paper, we present a computer vision system that detects the eye blink and face angle patterns for exhibiting signs of tiredness. In addition to the frame-based detection, we also introduce a time-window collation with a machine learning classifier. The system proposed here is critical in monitoring the user, performing real-time detection, and recommending they take a break if tiredness is detected. The overall system architecture and algorithmic details are presented, then a series of experiments are conducted to validate the performance of the approach.","2162-7576","978-1-6654-7966-0","10.1109/ARSO54254.2022.9802957","","https://ieeexplore.ieee.org/stamp/stamp.jsp?arnumber=9802957","Human-robot interaction;assistive robotics;mobility aids;pandemic solution;computer vision","Machine learning algorithms;Pandemics;Systems architecture;Robot sensing systems;Real-time systems;Sensors;Safety","computer vision;geriatrics;handicapped aids;learning (artificial intelligence);mobile robots;object detection;user interfaces","additional emphasis;assistive devices;assistive robots;computer vision system;COVID-19 pandemic;daily activities;elderly people;elderly users prefer;exhibiting signs;eye blink;face angle patterns;fall risks;frame-based detection;human support;increasingly significant health risk;machine learning classifier;passive assistive mobility devices;real-time detection;robotic mobility aid;sensing capabilities;system architecture;time-window collation;tiredness detection;walking","","","","20","IEEE","27 Jun 2022","","","IEEE","IEEE Conferences"
"Research on the Application of Social Network Service in Resource Sharing of Ideological and Political Education in Colleges","L. Cui","Chongqing Vocational College of Transportation, Chongqing, China","2020 International Conference on Robots & Intelligent System (ICRIS)","6 Sep 2021","2020","","","210","213","This paper takes the retrieval demand of Ideological and political education resources in colleges as the background, studies the system architecture, working principle, key technology, workflow and other related theories and technologies of vertical search engine, and designs an educational resource sharing system based on social network service mode. On one hand, the vector space model is constructed by extracting the semantic information of education and curriculum, and the topic search engine architecture is used to solve the problem of topic crawler topic concept set expression and URL importance judgment; on the other hand, a vertical search engine for educational resources is implemented and integrated by Herltix, Htmlparser and Lucene. Finally, by testing the function and performance of educational resource sharing system, it shows that the system can run well and achieve certain results.","","978-1-6654-1969-7","10.1109/ICRIS52159.2020.00060","","https://ieeexplore.ieee.org/stamp/stamp.jsp?arnumber=9523903","social network;resource sharing;ideological and political education;Lucene;crawler","Uniform resource locators;Social networking (online);Education;Semantics;Systems architecture;Search engines;Propulsion","computer aided instruction;educational institutions;information retrieval;politics;search engines;social networking (online)","colleges;system architecture;vertical search engine;social network service mode;topic search engine architecture;topic crawler topic concept;educational resources;Political education resources;URL importance judgment;educational resource sharing system performance","","","","8","IEEE","6 Sep 2021","","","IEEE","IEEE Conferences"
"Proposal of a New Model for Social Navigation Based on Extraction of Social Contexts from Ontology in Service Robots","F. de Assis Moura Pimentel; P. T. Aquino","Centro Universitário FEI; Dpto. de pós Graduação em Engenharia Elétrica, Centro Universitário FEI, S˜ao Bernardo do Campo - SP, Brazil","2019 Latin American Robotics Symposium (LARS), 2019 Brazilian Symposium on Robotics (SBR) and 2019 Workshop on Robotics in Education (WRE)","2 Mar 2020","2019","","","144","149","With the growing presence of service robots in social environments, research into the development of social behavior in robots is becoming increasingly necessary. Service robotics and social navigation are research areas that have been growing in recent years. However, helping humans with everyday tasks as well as people who need special attention, the elderly and children are still challenging issues in both the domestic and commercial environments. In this paper we present the current problem of social navigation in service robots, a state-of-the-art review of social navigation models, and we propose a new social navigation model using context extraction from ontology. This is expected to improve both the naturalness and the sociability of the robot as well as the comfort of the human being. This project intends to use current detection and learning techniques and tools such as OpenPose, as well as semantic mapping and deep learning. Navigation experiments were performed in simulated environment and selection of a navigation method. Also started implementing people tracking using OpenPose with satisfactory preliminary results. It is hoped that with this project, we can collaborate with the field of social navigation research using ontology approach.","2643-685X","978-1-7281-4268-5","10.1109/LARS-SBR-WRE48964.2019.00033","","https://ieeexplore.ieee.org/stamp/stamp.jsp?arnumber=9018600","Social;Navigation;Context;Ontology","Navigation;Mobile robots;Service robots;Safety;Robot sensing systems;Context modeling","control engineering computing;human-robot interaction;learning (artificial intelligence);neural nets;ontologies (artificial intelligence);service robots","social contexts;social behavior;service robotics;social navigation model;ontology;context extraction;semantic mapping;deep learning;people tracking;OpenPose","","","","18","IEEE","2 Mar 2020","","","IEEE","IEEE Conferences"
"Environmental Awareness in Preschool Education via Educational Robotics and STEAM Education","Z. Christidi; E. Christopoulou","Department of Informatics, Ionian University, Corfu, Greece; Department of Informatics, Ionian University, Corfu, Greece","2022 7th South-East Europe Design Automation, Computer Engineering, Computer Networks and Social Media Conference (SEEDA-CECNSM)","1 Nov 2022","2022","","","1","8","Nowadays there is a strong interest in the educational community and society in innovative technologies and more specifically on STEAM (Science, Technology, Engineering, Art and Mathematics) education and robotics. Via STEAM education and educational robotics the learning process and the development of students’ skills can undoubtedly be supported and developed. Additionally, students advance problem-solving and 21st century skills, like critical thinking, creativity and communication. The main aim of our research is to raise the environmental awareness of kindergarten students who were involved in educational robotics and STEAM education activities. This research study was completed as part of a real process, where our students, aged 4 to 6 years old, participated in eight educational activities focusing on water pollution and utilizing the programmable Blue Bot robot. Our research revealed that young students developed and acquired knowledge of programming and algorithmic thinking in a playful way through the use of the educational robot and managed to develop their cognitive and communication skills.","","979-8-3503-9858-8","10.1109/SEEDA-CECNSM57760.2022.9932911","","https://ieeexplore.ieee.org/stamp/stamp.jsp?arnumber=9932911","educational robotics;steam education;stem education;environmental education;environmental awareness;preschool education","Knowledge engineering;Social networking (online);Education;Water pollution;Mathematics;Teamwork;Problem-solving","computer aided instruction;educational institutions;educational robots;mobile robots","environmental awareness;preschool education;educational robotics;educational community;STEAM education activities;science technology engineering art and mathematics","","","","28","IEEE","1 Nov 2022","","","IEEE","IEEE Conferences"
"Investigating the Social Robots’ Role in Improving Children Attitudes toward Recycling. The case of PeppeRecycle","B. D. Carolis; F. D’Errico; N. Macchiarulo; V. Rossano","Department of Computer Science, University of Bari, Bari, Italy; Philosophy Communication and Visual Art Department, Roma Tre University; Exprivia srl, Molfetta, Italy; Department of Computer Science, University of Bari, Bari, Italy","2019 10th IEEE International Conference on Cognitive Infocommunications (CogInfoCom)","11 May 2020","2019","","","301","306","In this paper we investigate the impact of a social robot in the context of serious games in which the robot plays the role of a game opponent by challenging and, at the same time, teaching the child to correctly recycle waste materials. To this aim we performed a study in which we investigated the dimensions that are used to evaluate serious games integrated with those that are typical of the interaction with a social robot. To endow the robot with the capability to play as a game opponent in a real-world context, we implemented an image recognition module based on a Convolutional Neural Network so that the robot could detect and classify the waste material as a child would do, by seeing it. After a preliminary evaluation of the approach, we started a formal experiment in which we measured the effectiveness of game design, the robot evaluation and the evaluation of cognitive and affective elements that can form the pro-environmental attitude and then the tendency to recycling. A primary school classroom was involved in the study and, results obtained so far, are encouraging and drew promising possibilities for robotics education in changing recycling attitude for children since Pepper is positively evaluated as trustful and believable and this allowed to be concentrated on the `memorization' task during the game.","2380-7350","978-1-7281-4793-2","10.1109/CogInfoCom47531.2019.9089994","","https://ieeexplore.ieee.org/stamp/stamp.jsp?arnumber=9089994","Social robots;serious games;evaluation","Games;Robots;Recycling;Plastic products;Analysis of variance;Education;Waste materials","computer aided instruction;convolutional neural nets;educational robots;image recognition;recycling;serious games (computing);teaching","serious games;game opponent;waste material;social robot;real-world context;image recognition module;convolutional neural network;game design;robot evaluation;pro-environmental attitude;robotics education;changing recycling attitude;social robots;children attitudes","","3","","23","IEEE","11 May 2020","","","IEEE","IEEE Conferences"
"Mobile Human-Robot Interaction for personalized Health Training","J. Tessmer; F. Wallhoff","Jade University of Applied Sciences, Institute for Technical Assistive Systems (ITAS), Oldenburg, Germany; Jade University of Applied Sciences, Institute for Technical Assistive Systems (ITAS), Oldenburg, Germany","2019 International Conference on Digitization (ICD)","2 Jun 2020","2019","","","212","216","North-Western Germany and the Northern Netherlands Provinces have experienced increasing rural youth-out migration over the last decades. This has had stark economic, social and health implications for elderly populations that continue to reside in these areas. Many are at risk of spending their final years in isolation and increasing immobility, which has a severe impact on people's quality of life in older age and can lead to illness and loss of independence. In order to combat this problem a mobile training assistant application for movement exercises that utilizes a humanoid robot, NAO by Softbank Robotics, was prototypically implemented. The training assistant is designed to be used at home or in senior groups in isolated communities. Primarily, it is aimed to mobilize elderly people to empower them to live independent lives in their own homes and communities for as long as possible. The training assistant has been developed with elderly care workers and physiotherapists.","","978-1-7281-3841-1","10.1109/ICD47981.2019.9105825","","https://ieeexplore.ieee.org/stamp/stamp.jsp?arnumber=9105825","human-robot interaction;NAO robot;training assistant;ageing society;dialogue design;usability;gamification","Training;Economics;Senior citizens;Sociology;Humanoid robots;Human-robot interaction;Statistics","geriatrics;health care;humanoid robots;human-robot interaction;mobile robots","mobile training assistant application;movement exercises;humanoid robot;Softbank Robotics;elderly care workers;physiotherapists;mobile human-robot interaction;personalized health training;North-Western Germany;rural youth-out migration;stark economic health implications;social health implications;Northern Netherlands provinces;NAO","","","","30","IEEE","2 Jun 2020","","","IEEE","IEEE Conferences"
"Students participate and evaluate the design and development of a social robot","P. Christodoulou; A. A. May Reid; D. Pnevmatikos; C. R. del Rio; N. Fachantidis","Primary Education Department, University of Western Macedonia, Florina, Greece; Engineering Faculty, University of Cádiz, Cádiz, Spain; Primary Education Department, University of Western Macedonia, Florina, Greece; Engineering Faculty, University of Cádiz, Cádiz, Spain; Educational & Social Policy Department, University of Macedonia, Thessaloniki, Greece","2020 29th IEEE International Conference on Robot and Human Interactive Communication (RO-MAN)","14 Oct 2020","2020","","","739","744","Scholars have highlighted the importance of the humanoid appearance and the integration of various social cues for the design of Socially Assistive Robots for Education (SAR). However, designing a SAR for education omitting the stakeholders that will exploit it might prove a risky task. The aim of the current study, on the one hand, was to present the design of a SAR for Science Technology Engineering and Mathematics (STEM) education developed through stakeholders’ involvement in various steps of the approach. On the other hand, the study aimed to present the evaluation of the prototype robot through a STEM-oriented robot-assisted collaborative online teaching-learning sequence. Preliminary results indicate that participants endorsed the appearance and non-verbal behavior of the robot above chance level, while gender and age-related differences were revealed regarding the most appealing feature of the robot. Implications for Human-Robot Interaction are discussed.","1944-9437","978-1-7281-6075-7","10.1109/RO-MAN47096.2020.9223490","","https://ieeexplore.ieee.org/stamp/stamp.jsp?arnumber=9223490","","Education;Collaboration;Prototypes;Robot sensing systems;Turning;Sensors;Stakeholders","computer aided instruction;control engineering computing;humanoid robots;human-robot interaction;teaching","humanoid appearance;social cues;socially assistive robots;SAR;stakeholders;risky task;science technology engineering;prototype robot;STEM-oriented robot-assisted collaborative online teaching-learning sequence;human-robot interaction;mathematics education","","8","","41","IEEE","14 Oct 2020","","","IEEE","IEEE Conferences"
