"Design of a Robotic Coach for Motor, Social and Cognitive Skills Training Toward Applications With ASD Children","L. Santos; A. Geminiani; P. Schydlo; I. Olivieri; J. Santos-Victor; A. Pedrocchi","NEARLab, Department of Electronics, Information and Bioengineering, Politecnico di Milano, Milan, Italy; NEARLab, Department of Electronics, Information and Bioengineering, Politecnico di Milano, Milan, Italy; Institute for Systems and Robotics, Instituto Superior Técnico, Universidade de Lisboa, Lisbon, Portugal; IRCCS, Fondazione Don Carlo Gnocchi, Milan, Italy; Institute for Systems and Robotics, Instituto Superior Técnico, Universidade de Lisboa, Lisbon, Portugal; NEARLab, Department of Electronics, Information and Bioengineering, Politecnico di Milano, Milan, Italy","IEEE Transactions on Neural Systems and Rehabilitation Engineering","1 Jul 2021","2021","29","","1223","1232","Socially assistive robots may help the treatment of autism spectrum disorder(ASD), through games using dyadic interactions to train social skills. Existing systems are mainly based on simplified protocols which qualitatively evaluate subject performance. We propose a robotic coaching platform for training social, motor and cognitive capabilities, with two main contributions: (i) using triadic interactions(adult, robot and child), with robotic mirroring, and (ii) providing quantitative performance indicators. The key system features were accurately designed, including type of protocols, feedback systems and evaluation metrics, contemplating the requirements for applications with ASD children. We implemented two protocols, Robot-Master and Adult-Master, where children performed different gestures guided by the robot or the adult respectively, eventually receiving feedback about movement execution. In both, the robot mirrors the subject during the movement. To assess system functionalities, with a homogeneous group of subjects, tests were carried out with 28 healthy subjects; one preliminary acquisition was done with an ASD child. Data analysis was customized to design protocol-specific parameters for movement characterization. Our tests show that robotic mirroring execution depends on the complexity and standardization of movements, as well as on the robot technical features. The feedback system evaluated movement phases and successfully estimated the completion of the exercises. Future work includes improving platform flexibility and adaptability, and clinical trials with ASD children to test the impact of the robotic coach on reducing symptoms. We trust that the proposed quantitative performance indicators extend the current state-of-the-art towards clinical usage of robotic-based coaching systems.","1558-0210","","10.1109/TNSRE.2021.3091320","Portuguese Foundation of Science and Technology(grant numbers:SFRH/BD/145040/2019,SFRH/BD/139092/2018); CerebNest (partnering project of the Human Brain Project) through the U.S. National Institutes of Health(grant numbers:1R01HD081346-01A); Subaward University of Southern California-Politecnico di Milano (USC-POLIMI)(grant numbers:61430868); Fondazione Zorzi through the Project Interactive mirrOring Games wIth sOCial rObot (IOGIOCO); ","https://ieeexplore.ieee.org/stamp/stamp.jsp?arnumber=9461769","Robotic coaching;embodied mirroring;robotic therapy;human-robot interaction;movement metrics","Robots;Protocols;Variable speed drives;Training;Robot kinematics;Games;Shoulder","biomechanics;cognition;computer aided instruction;data analysis;handicapped aids;human-robot interaction;medical computing;medical disorders;medical robotics;mobile robots;paediatrics;patient treatment;protocols;robot programming","quantitative performance indicators;robotic-based coaching systems;robotic coach;ASD children;socially assistive robots;dyadic interactions;social skills;simplified protocols;subject performance;robotic coaching platform;motor;cognitive capabilities;triadic interactions;key system features;feedback system;evaluation metrics;Robot-Master;Adult-Master;movement execution;system functionalities;28 healthy subjects;ASD child;design protocol-specific parameters;movement characterization;robotic mirroring execution;robot technical features;movement phases","Adult;Autism Spectrum Disorder;Child;Cognition;Gestures;Humans;Robotic Surgical Procedures;Robotics","8","","28","CCBY","21 Jun 2021","","","IEEE","IEEE Journals"
"User and Robot Personality Interactions in Parasocial Presence and Intention to Use Social Robots","F. Montalvo; P. Thai; P. Stephens; L. Jones; D. McConnell; J. Smither","Department of Psychology, University of Central Florida, Orlando, United States; Department of Psychology, University of Central Florida, Orlando, United States; Department of Psychology, University of Central Florida, Orlando, United States; Department of Health Sciences, University of Central Florida, Orlando, United States; Department of Psychology, University of Central Florida, Orlando, United States; Department of Psychology, University of Central Florida, Orlando, United States","2022 IEEE 3rd International Conference on Human-Machine Systems (ICHMS)","19 Dec 2022","2022","","","1","3","The present research explores how the relationship between a user’s personality and the perceived personality of a social robot influences the relationship of parasocial presence, para-friendship, and intention to use a social robot. Specifically, the research examines how continued use of a social robot is related to the interaction of user and perceived robot personality through the mediating role of parasocial presence. Participants interacted with a social robot in a semi-structured interaction and provided ratings of parasocial presence, robot personality, and use intention. Although parasocial presence and para-friendship aspects the interaction predicted intention to use the robot, personality similarity at the profile level did not impact this relationship.","","978-1-6654-5238-0","10.1109/ICHMS56717.2022.9980632","","https://ieeexplore.ieee.org/stamp/stamp.jsp?arnumber=9980632","Social Robots;Parasocial Presence;Parasocial Friendship;Use Intention;Personality;Human-Robot Interaction","Social robots;Man-machine systems","human-robot interaction;social robots","para-friendship aspects;parasocial presence;perceived robot personality;robot personality interactions;semi-structured interaction;social robot;user's personality","","","","13","IEEE","19 Dec 2022","","","IEEE","IEEE Conferences"
"Robots for Learning - R4L: Adaptive Learning","W. Johal; A. Sandygulova; J. de Wit; M. de Haas; B. Scassellati","CHILI - LSRO Lab, Ècole Fédérale Polytechnique, Lausanne, Switzerland; School of Science and Technology, Nazarbayev University, Astana, Kazakhstan; Department of Communication and Cognition, Tilburg University, Tilburg, Netherlands; Department of Cognitive Science and Artificial Intelligence, Tilburg University, Tilburg, Netherlands; Social Robotics Lab, Yale University, New Haven, USA","2019 14th ACM/IEEE International Conference on Human-Robot Interaction (HRI)","25 Mar 2019","2019","","","693","694","The Robots for Learning workshop series aims at advancing the research topics related to the use of social robots in educational contexts. This year's half-day workshop follows on previous events in Human-Robot Interaction conferences focusing on efforts to design, develop and test new robotics systems that help learners. This 5th edition of the workshop will be dealing in particular on the potential use of robots for adaptive learning. Since the past few years, inclusive education have been a key policy in a number of countries, aiming to provide equal changes and common ground to all. In this workshop, we aim to discuss strategies to design robotics system able to adapt to the learners' abilities, to provide assistance and to demonstrate long-term learning effects.","2167-2148","978-1-5386-8555-6","10.1109/HRI.2019.8673109","","https://ieeexplore.ieee.org/stamp/stamp.jsp?arnumber=8673109","learning;education;social robots;human-robot interaction","Robots;Conferences;Human-robot interaction;Adaptive learning;Cognitive science;Adaptive systems","computer aided instruction;educational robots;human-robot interaction","adaptive learning;social robots;educational contexts;robotics system;inclusive education;long-term learning effects;human-robot interaction conferences;robots for learning;R4L","","1","","4","IEEE","25 Mar 2019","","","IEEE","IEEE Conferences"
"Similarity Attraction for Robot's Dialect in Language Learning Using Social Robots","A. Pazylbekov; D. Kalym; A. Otynshin; A. Sandygulova","Nazarbayev University, Astana, Kazakhstan; Nazarbayev University, Astana, Kazakhstan; Nazarbayev University, Astana, Kazakhstan; Nazarbayev University, Astana, Kazakhstan","2019 14th ACM/IEEE International Conference on Human-Robot Interaction (HRI)","25 Mar 2019","2019","","","532","533","The gradual transition towards the Kazakh language in the Republic of Kazakhstan raises the emergence of applying new technologies for learning the language. Considering the fact that the Kazakh language has dialectal forms, it is important to investigate how these language features would affect the interaction with the synthesized speech of a robot or a computer program. This paper presents a preliminary study exploring the effect of dialectal language on the human-robot interaction in an education-oriented environment. Participants were involved in the interaction with two different robots with pre-programmed language dialectal patterns - South and non-South, to learn new vocabulary. Findings show that there is a low significance in correlation, however, it is suggested that a small sample size led to the obtained results.","2167-2148","978-1-5386-8555-6","10.1109/HRI.2019.8673232","","https://ieeexplore.ieee.org/stamp/stamp.jsp?arnumber=8673232","language learning;education;social robots;human-robot interaction","Robots;Human-robot interaction;Education;Correlation;Animals;Vocabulary;Indexes","human-robot interaction;speech synthesis","social robots;Kazakh language;human-robot interaction;computer programming;pre-programmed language dialectal patterns;Republic of Kazakhstan;dialectal language learning effect;education-oriented environment;speech synthesis","","1","","8","IEEE","25 Mar 2019","","","IEEE","IEEE Conferences"
"Human-Robot Co-Teaching in Online University Course during Covid-19","A. M. Velentza; I. Lefkos; N. Fachantidis","School of Educational & Social Policy, University of Macedonia, Thessaloniki, Greece; School of Educational & Social Policy, University of Macedonia, Thessaloniki, Greece; School of Educational & Social Policy, University of Macedonia, Thessaloniki, Greece","2022 13th International Conference on Information, Intelligence, Systems & Applications (IISA)","30 Sep 2022","2022","","","1","6","Online lectures are extensively used in the academic area. Especially due to the Covid-19 lockdown restriction measures, the educational institutions were forced to conduct online classes. Consequently, it is important to determine how these classes can become more enjoyable while at the same time delivering the academic objectives to the students and how academic tutors can optimally interact with students. This paper specifically looks at the performance of social robots in place of university co-tutors, in the field of engineering, measuring the students’ enjoyment and understanding of the basic principles of the lecture’s content. Inspired by previous educational studies which have evidenced beneficial effects for both students and tutors after taught/conducting lectures with two collaborative tutors, the goal of this research is a) to test the students’ evaluation of two collaborative human tutors in comparison with one individual human when teaching academic lectures during online lectures, and b) to investigate the effect of a social robot co-tutor after comparing students understanding and level of enjoyment after attending a lecture given by human-human or human-robot co-tutors. The lectures took place via an online educational platform during an actual university course. Results indicated that students evaluated higher the co-tutor lectures in comparison with the individual tutor lectures, while they equally enjoyed and gained knowledge from both human-human and human-robot cotutored lectures.","","978-1-6654-6390-4","10.1109/IISA56318.2022.9904335","","https://ieeexplore.ieee.org/stamp/stamp.jsp?arnumber=9904335","social robots;education;co-teacher;co-tutor;human robot interaction;online course","COVID-19;Force measurement;Social robots;Education;Collaboration","computer aided instruction;educational courses;educational institutions;further education;human-robot interaction;intelligent tutoring systems;teaching","online lectures;Covid-19 lockdown restriction measures;educational institutions;online classes;academic objectives;academic tutors;university co-tutors;lecture content;collaborative human tutors;social robot co-tutor;human-robot co-tutors;online educational platform;co-tutor lectures;human-robot cotutored lectures;online university course;human-robot co-teaching;student interaction;academic lecture teaching","","","","40","IEEE","30 Sep 2022","","","IEEE","IEEE Conferences"
"Social Robot to teach coding in primary school","R. Lanzilotti; A. Piccinno; V. Rossano; T. Roselli","Dept of Computer Science, University of Bari, Bari, Italy; Dept of Computer Science, University of Bari, Bari, Italy; Dept of Computer Science, University of Bari, Bari, Italy; Dept of Computer Science, University of Bari, Bari, Italy","2021 International Conference on Advanced Learning Technologies (ICALT)","2 Aug 2021","2021","","","102","104","Computational Thinking (CT) education is spreading all over the world involving all levels of schools. Software and hardware solutions have been designed and developed to introduce CT at school. In this paper, the first trial of coding activities has been realized using Pepper Social Robot. The idea is to allow pupils to program Pepper; the mission is to guide the robot through a path on a grid sketched on the floor to reach a predefined target. A user test was conducted to evaluate the experience of pupils, in terms of effectiveness, engagement, and cognitive workload in a learning coding activity that involves the social robot Pepper. Pupils appreciated the use of the robot which can interact with them, they were very engaged in the activity and improve their knowledge about coding.","2161-377X","978-1-6654-4106-3","10.1109/ICALT52272.2021.00038","","https://ieeexplore.ieee.org/stamp/stamp.jsp?arnumber=9499862","Coding;Computational Thinking;Social Robot","Education;Encoding;Software;Hardware;Pupils;Robots;Floors","cognition;computer aided instruction;computer science education;educational institutions;humanoid robots;mobile robots;teaching","user test;pupils;learning coding activity;social robot Pepper;primary school;Computational Thinking education;CT;hardware solutions;coding activities;Pepper Social Robot;predefined target","","","","16","IEEE","2 Aug 2021","","","IEEE","IEEE Conferences"
"New Efficiency: Introducing Social Assistive Robots in Social Eldercare Organizations","R. Hasenauer; C. Belviso; I. Ehrenmueller","Department of Marketing, WU University of Economy and Business, Wien, Austria; Department of Marketing, WU University of Economy and Business, Wien, Austria; Department of Health Care Social and Public Management, University of Applied Sciences Upper Austria, Linz, Austria","2019 IEEE International Symposium on Innovation and Entrepreneurship (TEMS-ISIE)","23 Apr 2020","2019","","","1","6","This paper continues to develop the fundamental requirements of a living lab as social experiment on the multistage integration of Social Assistive Robots in an AAL environment with caregiver capacity shortage and elder people living with different physical and mental stages. Starting from the results of a pre-study conducted on 130 dependent living elderly in Austria retirement houses, this paper presents a process-costs-calculation of Social Assistive Robots (SAR) introduction in the process of eldercare (""CareSAR"") and suggests a program to optimize the benefit of these solutions under the aspects of shortage of caregivers, high quality of medical care and ethics.","","978-1-7281-0435-5","10.1109/TEMS-ISIE46312.2019.9074296","","https://ieeexplore.ieee.org/stamp/stamp.jsp?arnumber=9074296","Social Assistive Robots;Elder Care;Ethics;digitization;new efficiency;artificial intelligence;robotics;ambient assisted living","Robots;Organizations;Medical services;Technological innovation;Entrepreneurship;Retirement;Task analysis","assisted living;control engineering computing;geriatrics;health care;human-robot interaction;medical robotics;patient care","elder people;physical stages;mental stages;social assistive robots;living lab;social experiment;caregiver capacity shortage;social eldercare organizations;CareSAR;Austria retirement houses","","7","","14","IEEE","23 Apr 2020","","","IEEE","IEEE Conferences"
"Social Robot Selection: A Case Study in Education","G. A. Papakostas; A. K. Strolis; F. Panagiotopoulos; C. N. Aitsidis","Human-Machines Interaction Laboratory (HUMAIN-Lab), Eastern Macedonia and Thrace Institute of Technology, Kavala, Greece; Human-Machines Interaction Laboratory (HUMAIN-Lab), Eastern Macedonia and Thrace Institute of Technology, Kavala, Greece; Department of Business Administration, Eastern Macedonia and Thrace Institute of Technology, Kavala, Greece; Department of Business Administration, Eastern Macedonia and Thrace Institute of Technology, Kavala, Greece","2018 26th International Conference on Software, Telecommunications and Computer Networks (SoftCOM)","2 Dec 2018","2018","","","1","4","In this paper the problem of selecting the appropriate social robot in education is being investigated for the first time. The social robot selection task is handled as a multi-criteria decision making problem and solved using the TOPSIS ranking method. Initially, a set of criteria is defined, based on the technical properties and human-interaction capabilities of the social robots. In a second stage some experts quantify a set of alternative social robots according to the predefined criteria and the robots are ranked by applying the TOPSIS method. The preliminary results are very promising and reveal the necessity of selecting the most suitable social robot subject to the educational needs and the technical requirements defined by the end user.","1847-358X","978-9-5329-0087-3","10.23919/SOFTCOM.2018.8555844","","https://ieeexplore.ieee.org/stamp/stamp.jsp?arnumber=8555844","social robots;robot selection;decision making;TOPSIS;multicriteria analysis","Technical requirements;Education;Decision making;Software;Computer networks;Telecommunications;Task analysis","computer aided instruction;decision making;educational robots;human-robot interaction;operations research;TOPSIS","social robot selection task;multicriteria decision making problem;TOPSIS ranking method;human-interaction capabilities;alternative social robots;TOPSIS method;social robot subject;education","","8","","9","","2 Dec 2018","","","IEEE","IEEE Conferences"
"The Robot Screener Will See You Now: A Socially Assistive Robot for COVID-19 Screening in Long-Term Care Homes","C. Getson; G. Nejat","Department of Mechanical and Industrial Engineering, Autonomous Systems and Biomechatronics Lab, University of Toronto, Toronto, Canada; Department of Mechanical and Industrial Engineering, Autonomous Systems and Biomechatronics Lab, University of Toronto, Toronto, Canada","2022 31st IEEE International Conference on Robot and Human Interactive Communication (RO-MAN)","30 Sep 2022","2022","","","672","677","The rapid spread of COVID-19 around the globe has increased the need to adopt autonomous social robots within our healthcare systems. In particular, socially assistive robots can help to improve the day-to-day functioning of our healthcare facilities including long-term care, while keeping residents and staff safe by performing repetitive tasks such as health screening. In this paper, we present the first human-robot interaction study with an autonomous multi-task socially assistive robot used for non-contact screening in long-term care homes. The robot monitors temperature, checks for face masks, and asks screening questions to minimize human-to-human contact. We investigated staff perceptions of 7 attributes: screening experience without and with the robot, efficiency, cognitive attitude, freeing up staff, safety, affective attitude, and intent to use the robot. Furthermore, we investigated the influence of demographics on these attributes. Study results show that, overall, staff rated these attributes high for the screening robot, with a statistically significant increase in cognitive attitude and safety after interacting with the robot. Differences between gender and occupation were also determined. Our study highlights the potential application of an autonomous screening robot for long-term care homes.","1944-9437","978-1-7281-8859-1","10.1109/RO-MAN53752.2022.9900620","Health; ","https://ieeexplore.ieee.org/stamp/stamp.jsp?arnumber=9900620","","COVID-19;Temperature sensors;Temperature measurement;Pandemics;Social robots;Medical services;Assistive robots","assistive robots;cognition;diseases;epidemics;health care;medical robotics;mobile robots;patient monitoring;protective clothing;social robots","human-robot interaction;noncontact screening;long-term care homes;human-to-human contact;cognitive attitude;autonomous screening robot;robot screener;COVID-19 screening;health screening;health care systems;temperature monitoring;health care facilities;autonomous multitask socially assistive robot;face masks;staff perceptions;affective attitude","","2","","32","IEEE","30 Sep 2022","","","IEEE","IEEE Conferences"
"Study on Quasi-passive Walking Robot Based on Impulse Thrust","J. Liu; X. Chen; X. Qiu; L. Meng; Z. Yu; Q. Huang","School of Mechatronical Engineering, Beijing Institute of Technology, Beijing, China; Beijing Advanced Innovation Center for Intelligent Robotics and Systems, Beijing Institute of Technology, Beijing, China; School of Mechatronical Engineering, Beijing Institute of Technology, Beijing, China; Key Laboratory of Biomimetic Robots and Systems, Ministry of Education, Beijing, China; Key Laboratory of Biomimetic Robots and Systems, Ministry of Education, Beijing, China; Beijing Advanced Innovation Center for Intelligent Robotics and Systems, Beijing Institute of Technology, Beijing, China","2019 IEEE International Conference on Advanced Robotics and its Social Impacts (ARSO)","6 Jan 2020","2019","","","261","264","Based on the passive walking robots, a new quasi-passive walking robot based on impulse thrust is studied. Firstly, we establish a simple quasi-passive walking robot model. The dynamic equation and the transition equation of the simplest two-link model are analyzed by using angular momentum theorem. The existence and stability of the fixed points are analyzed by using Poincare map. Secondly, we use MATLAB to simulate the walking robot, calculate the fixed points of the quasi-passive walking robot, and analyze the stability of the system through the eigenvalue of Jacobian of the linearized map. The feasibility of impulse thrust and telescopic leg is verified.","2162-7576","978-1-7281-3176-4","10.1109/ARSO46408.2019.8948783","","https://ieeexplore.ieee.org/stamp/stamp.jsp?arnumber=8948783","","","eigenvalues and eigenfunctions;legged locomotion;motion control;Poincare mapping;robot dynamics;stability","passive walking robots;quasipassive walking robot model;dynamic equation;transition equation;two-link model;angular momentum theorem;Poincare map;MATLAB;Jacobian;telescopic leg;impulse thrust","","","","14","IEEE","6 Jan 2020","","","IEEE","IEEE Conferences"
